{"businessTransactionId":"txn-1","correlationId":"corr-1","details":{"amount":"1499.00","currency":"INR","lineItems":[{"quantity":2,"sku":"SKU-1"}],"orderId":"d1e02e42-264b-4ead-ab1a-cfbf16799bd0","orderVersion":1},"eventId":"14b47a9f-5d34-4a02-bb08-2cd504ca9f43","eventType":"OrderCreated","occurredAt":"2026-10-12T08:00:00.123456Z","schemaVersion":"1.0","sourceSystem":"order-service","tenantId":"tenant-demo"}
